{
  "analysis_name": "5gc-handover-mobility",
  "analysis_version": "0.1.1",
  "handover_attempts": [],
  "limitations": [
    "A procedure-local deviation is protocol evidence; it never attributes blame to any network element, implementation, or radio layer",
    "Handover and Path Switch are separate attempt families; neither is required for the other",
    "Source/target association requires the same capture, a scoped AMF-UE-NGAP-ID context, compatible roles, and temporal sanity; timestamp proximity alone never associates anything",
    "N11/N4/N3 supporting evidence is associated only through safe session/tunnel context; an HTTP 2xx or PFCP accepted response never becomes mobility success, and missing N11/N4/N3 evidence never becomes mobility failure",
    "Supporting-plane association is evaluated globally across all mobility attempts and one N11/PFCP/GTP-U event belongs to at most one attempt; ambiguous events stay unbound",
    "PDU Session identity is not mobility attempt identity: N11 UpdateSMContext evidence binds only through reviewed mobility-specific N2 SM Information Types, which the current lower SBI contract does not expose",
    "PFCP SEIDs are endpoint/session scoped; GTP-U binding is direction sensitive; and an N2 handover to Path Switch relationship is never inferred from common AMF context and time",
    "GTP-U observations prove capture-point observation only; tunnel roles stay neutral because reviewed tunnel lifecycle context is not established in this version",
    "Inter-system HandoverTypes are preserved with a scope limitation; no inter-system or 5GS-EPS mobility semantics are applied",
    "This analysis is bounded to the supplied evidence files; absence of evidence is never reported as network absence"
  ],
  "path_switch_attempts": [],
  "procedure_family": "5gc-handover-mobility",
  "unbound_mobility_evidence": []
}
