{
  "analysis_name": "5gc-handover-mobility",
  "analysis_version": "0.1.0",
  "handover_attempts": [
    {
      "association": {
        "basis": "no target-side evidence within the same scoped AMF-UE-NGAP-ID context satisfies the reviewed association rule",
        "candidates": [],
        "strength": "UNBOUND"
      },
      "attempt_id": "5gc-ho:mobility-test.pcapng:sctp-assoc-0:r1:1",
      "attempt_id_basis": "DERIVED display reference 5gc-ho:<capture>:<association>:<ran-id>:<sequence>; consumers must read the structured source_context/target_context fields, never parse this string",
      "deviations": [],
      "earliest_observed_deviation": null,
      "events": [
        {
          "amf_ue_ngap_id": 2,
          "association": "sctp-assoc-0",
          "capture_file": "mobility-test.pcapng",
          "cause": {
            "category": "radioNetwork",
            "value": 3
          },
          "frame_number": 10,
          "handover_type": "intra5gs",
          "message_type": "HandoverRequired",
          "pdu_session_ids": [],
          "pdu_type": "initiatingMessage",
          "protocol": "NGAP",
          "ran_ue_ngap_id": 1,
          "resource_roles": [],
          "role": "source",
          "timestamp": "2026-01-06T00:00:01.000000Z"
        },
        {
          "amf_ue_ngap_id": 2,
          "association": "sctp-assoc-0",
          "capture_file": "mobility-test.pcapng",
          "cause": {
            "category": "radioNetwork",
            "value": 3
          },
          "frame_number": 12,
          "handover_type": null,
          "message_type": "HandoverCancel",
          "pdu_session_ids": [],
          "pdu_type": "initiatingMessage",
          "protocol": "NGAP",
          "ran_ue_ngap_id": 1,
          "resource_roles": [],
          "role": "source",
          "timestamp": "2026-01-06T00:00:03.000000Z"
        },
        {
          "amf_ue_ngap_id": 2,
          "association": "sctp-assoc-0",
          "capture_file": "mobility-test.pcapng",
          "cause": null,
          "frame_number": 14,
          "handover_type": null,
          "message_type": "HandoverCancelAcknowledge",
          "pdu_session_ids": [],
          "pdu_type": "successfulOutcome",
          "protocol": "NGAP",
          "ran_ue_ngap_id": 1,
          "resource_roles": [],
          "role": "source",
          "timestamp": "2026-01-06T00:00:05.000000Z"
        }
      ],
      "family": "handover",
      "field_findings": [
        {
          "capture_file": "mobility-test.pcapng",
          "evidence_level": "OBSERVED",
          "field_name": "NGAP cause",
          "frame_number": 10,
          "interpretation": "NGAP cause carried by the observed message; procedure evidence, never attribution",
          "limitations": [],
          "message_type": "HandoverRequired",
          "normalized_value": "radioNetwork:3",
          "observed_value": {
            "category": "radioNetwork",
            "value": 3
          },
          "protocol": "NGAP"
        },
        {
          "capture_file": "mobility-test.pcapng",
          "evidence_level": "OBSERVED",
          "field_name": "NGAP cause",
          "frame_number": 12,
          "interpretation": "NGAP cause carried by the observed message; procedure evidence, never attribution",
          "limitations": [],
          "message_type": "HandoverCancel",
          "normalized_value": "radioNetwork:3",
          "observed_value": {
            "category": "radioNetwork",
            "value": 3
          },
          "protocol": "NGAP"
        }
      ],
      "handover_type": {
        "domain_scope": "INTRA_5GS",
        "name": "intra5gs",
        "scope_status": "SUPPORTED_FOR_DOMAIN_PROCEDURE",
        "value": 0
      },
      "limitations": [
        "A procedure-local deviation is protocol evidence; it never attributes blame to any network element, implementation, or radio layer",
        "No target-side handover evidence was observed for this attempt; the target context stays unknown and is never guessed from timestamps or identifier equality"
      ],
      "observation_window": {
        "first_frame": 10,
        "first_timestamp": "2026-01-06T00:00:01.000000Z",
        "last_frame": 14,
        "last_timestamp": "2026-01-06T00:00:05.000000Z"
      },
      "pdu_session_resources": [],
      "plane_bindings": {
        "n11": [],
        "n3": [],
        "n4": []
      },
      "source_context": {
        "amf_ue_ngap_id": 2,
        "association": "sctp-assoc-0",
        "capture_file": "mobility-test.pcapng",
        "ran_ue_ngap_id": 1,
        "role": "source",
        "side": "SOURCE_ONLY"
      },
      "stages": [
        {
          "missing": [],
          "observed": [
            {
              "capture_file": "mobility-test.pcapng",
              "cause": {
                "category": "radioNetwork",
                "value": 3
              },
              "evidence_level": "OBSERVED",
              "frame_number": 10,
              "message_type": "HandoverRequired",
              "protocol": "NGAP",
              "timestamp": "2026-01-06T00:00:01.000000Z"
            }
          ],
          "stage_id": "HANDOVER_INITIATION",
          "stage_name": "Handover initiation (HandoverRequired)",
          "status": "OBSERVED"
        },
        {
          "missing": [],
          "observed": [
            {
              "capture_file": "mobility-test.pcapng",
              "cause": {
                "category": "radioNetwork",
                "value": 3
              },
              "evidence_level": "OBSERVED",
              "frame_number": 12,
              "message_type": "HandoverCancel",
              "protocol": "NGAP",
              "timestamp": "2026-01-06T00:00:03.000000Z"
            },
            {
              "capture_file": "mobility-test.pcapng",
              "cause": null,
              "evidence_level": "OBSERVED",
              "frame_number": 14,
              "message_type": "HandoverCancelAcknowledge",
              "protocol": "NGAP",
              "timestamp": "2026-01-06T00:00:05.000000Z"
            }
          ],
          "stage_id": "HANDOVER_CANCELLATION",
          "stage_name": "Handover cancellation (HandoverCancel, HandoverCancelAcknowledge)",
          "status": "OBSERVED"
        }
      ],
      "target_context": null,
      "terminal_observation": {
        "evidence_level": "OBSERVED",
        "frame_number": 14,
        "message_type": "HandoverCancelAcknowledge",
        "observation": "HANDOVER_CANCEL_ACK_OBSERVED",
        "timestamp": "2026-01-06T00:00:05.000000Z"
      },
      "unbound_evidence": []
    }
  ],
  "limitations": [
    "A procedure-local deviation is protocol evidence; it never attributes blame to any network element, implementation, or radio layer",
    "Handover and Path Switch are separate attempt families; neither is required for the other",
    "Source/target association requires the same capture, a scoped AMF-UE-NGAP-ID context, compatible roles, and temporal sanity; timestamp proximity alone never associates anything",
    "N11/N4/N3 supporting evidence is associated only through safe session/tunnel context; an HTTP 2xx or PFCP accepted response never becomes mobility success, and missing N11/N4/N3 evidence never becomes mobility failure",
    "GTP-U observations prove capture-point observation only; tunnel roles stay neutral because reviewed tunnel lifecycle context is not established in this version",
    "Inter-system HandoverTypes are preserved with a scope limitation; no inter-system or 5GS-EPS mobility semantics are applied",
    "This analysis is bounded to the supplied evidence files; absence of evidence is never reported as network absence"
  ],
  "path_switch_attempts": [],
  "procedure_family": "5gc-handover-mobility",
  "unbound_mobility_evidence": []
}
